{
  "schema_version": "1.0",
  "report_id": "rpt_01J6R7R2VAYM5X4S9ACQ",
  "trigger": "javascript_crash",
  "triggered_at": "2026-08-19T08:30:00Z",
  "submitted_at": "2026-08-19T08:30:00Z",
  "release": {
    "platform": "react_native",
    "app_version": "0.1.0",
    "native_build": "1",
    "js_bundle_version": "ota-42",
    "environment": "development"
  },
  "sdk": {
    "name": "crumb-react-native",
    "version": "0.0.1",
    "integration": "react_native"
  },
  "runtime": {
    "os": "ios",
    "os_version": "26.0",
    "device_family": "iPhone",
    "locale": "en-BG",
    "timezone": "Europe/Sofia"
  },
  "user_input": {
    "category": "javascript_crash",
    "description": "TypeError: Checkout button handler failed"
  },
  "javascript_crash": {
    "source": "javascript",
    "kind": "fatal_exception",
    "error_type": "TypeError",
    "message": "Checkout button handler failed",
    "raw_stack": "TypeError: Checkout button handler failed\n    at submitOrder (Checkout.tsx:42:7)",
    "deduplication_key": "js_7f4a1b2c",
    "native_termination_wrapper": false,
    "breadcrumbs": [
      {
        "timestamp": "2026-08-19T08:29:59Z",
        "category": "javascript",
        "message": "Checkout started"
      }
    ]
  },
  "diagnostics": {
    "captured_at": "2026-08-19T08:30:00Z",
    "location": "javascript_crash_recovery",
    "process": {
      "name": "MerchantApp",
      "id": 4182
    },
    "thermal_state": "unavailable",
    "threads": {
      "count": 0,
      "busiest": []
    },
    "gpu": {
      "status": "unavailable_on_demand"
    },
    "network": {
      "status": "unknown",
      "transport": "unknown",
      "is_expensive": false,
      "is_constrained": false
    },
    "logs": {
      "status": "unavailable",
      "sources": [],
      "entries": [],
      "truncated": false,
      "dropped_entry_count": 0,
      "failures": ["crash_recovery"]
    },
    "stack_traces": {
      "status": "unavailable",
      "scope": "none",
      "threads": [],
      "truncated": false,
      "unavailable_reason": "crash_recovery"
    }
  },
  "privacy": {
    "screenshot_capture": "not_applicable",
    "screenshot_masking": "not_applicable",
    "diagnostics_capture": "crash_recovery",
    "log_capture": "not_applicable"
  },
  "custom_context": {
    "account_tier": "trial"
  },
  "artifacts": []
}
